{
  "$schema": "https://json-schema.org/draft/2020-12/schema",
  "$id": "https://ai-dev-loop.local/schemas/scheduler-frozen-sequence-entry-v3.json",
  "title": "FrozenSequenceEntryV3", "type": "object", "additionalProperties": false,
  "required": ["schema_version", "ordinal", "phase_name", "planned_run_id", "plan_prompt", "effective_config", "codex", "cursor", "workflow", "implementer"],
  "properties": {
    "schema_version": {"const": 3}, "ordinal": {"type": "integer", "minimum": 1}, "phase_name": {"type": "string", "minLength": 1}, "planned_run_id": {"type": "string", "minLength": 1}, "commit_message": {"type": ["string", "null"]},
    "plan_prompt": {"$ref": "scheduler-submitted-run-context-v3.json#/$defs/plan_prompt_binding"},
    "effective_config": {"$ref": "scheduler-submitted-run-context-v3.json#/$defs/effective_config_binding"},
    "codex": {"$ref": "scheduler-submitted-run-context-v3.json#/$defs/fresh_codex_reviewer_binding"},
    "cursor": {"$ref": "scheduler-submitted-run-context-v7.json#/$defs/sdkCursorBinding"},
    "workflow": {"$ref": "scheduler-submitted-run-context-v3.json#/$defs/workflow_limits"},
    "implementer": {"oneOf": [{"$ref": "scheduler-submitted-run-context-v5.json#/$defs/implementer_binding"}, {"$ref": "scheduler-submitted-run-context-v7.json#/$defs/sdkImplementer"}]}
  }
}
