{"schema_version":3,"ordinal":1,"phase_name":"fixture-phase-1","planned_run_id":"sdk-v8-privacy-safe-fixture-1","commit_message":"accepted fixture checkpoint","plan_prompt":{"plan_repository_path":"docs/plans/sample-plan.md","prompt_source_repository_path":"docs/plans/prompt.txt","plan_artifact_path":"plan/plan.md","plan_sha256":"aaaaaaaaaaaaaaaaaaaaaaaaaaaaaaaaaaaaaaaaaaaaaaaaaaaaaaaaaaaaaaaa","prompt_artifact_path":"prompts/cursor-initial.txt","prompt_sha256":"aaaaaaaaaaaaaaaaaaaaaaaaaaaaaaaaaaaaaaaaaaaaaaaaaaaaaaaaaaaaaaaa"},"effective_config":{"effective_config_artifact_path":"effective-config.yaml","effective_config_sha256":"aaaaaaaaaaaaaaaaaaaaaaaaaaaaaaaaaaaaaaaaaaaaaaaaaaaaaaaaaaaaaaaa","source_config_artifact_path":"source-config.yaml","source_config_sha256":"aaaaaaaaaaaaaaaaaaaaaaaaaaaaaaaaaaaaaaaaaaaaaaaaaaaaaaaaaaaaaaaa"},"codex":{"review_model":"gpt-5.6-sol","review_reasoning_effort":"high","review_model_source":"explicit","review_reasoning_source":"explicit","command":"codex","review_skill":"review-staged-cursor-execution","sandbox":"workspace-write","binding_artifact_path":"codex/fresh-reviewer-input.json","binding_sha256":"aaaaaaaaaaaaaaaaaaaaaaaaaaaaaaaaaaaaaaaaaaaaaaaaaaaaaaaaaaaaaaaa"},"cursor":{"schema_version":1,"runtime":"sdk-local","sdk_version":"1.0.37","model":"fixture-sdk-model","parameters":{"context":"256k","fast":false,"reasoning_effort":"high"},"credential_ref":"fixture-credential-reference","setting_sources":["project"],"sandbox":"disabled","tool_policy":"scheduler-owned-no-shell"},"workflow":{"max_review_iterations":3,"stage_mode":"all","cursor_timeout_minutes":30,"codex_timeout_minutes":30,"require_clean_worktree":true},"implementer":{"schema_version":2,"provider":"cursor","purpose":"implementer","runtime":"sdk-local","model":"fixture-sdk-model","reasoning_effort":null,"timeout_minutes":90,"sandbox":"disabled","approval_policy":null,"session_id":null}}
